SELECT DISTINCT(`unanswered_calls_limit`) as `distinct_limit`, COUNT(`unanswered_calls_limit`) as `counter` FROM `agent_data` GROUP BY `unanswered_calls_limit` ORDER BY `counter` DESC LIMIT 20;
+----------------+---------+
| distinct_limit | counter |
+----------------+---------+
|              3 |      27 |
|             99 |      19 |
|              0 |      15 |
|              5 |      12 |
|              2 |       4 |
|             30 |       2 |
|              4 |       2 |
|              1 |       1 |
|             88 |       1 |
|              6 |       1 |
|              7 |       1 |
+----------------+---------+
11 rows in set (0.00 sec)



show CREATE TABLE agent_data;
+------------+-------------------------------------------------------------------------------------------------------------------------------------------------------------------------------------------------------------------------------------------------------------------------------------------------------------------------------------------------------------------------------------------------------------------------------------------------------------------------------------------------------------------------------------------------------------------------------------------------------------------------------------------------------------------------------------------------------------------------------------------------------------------------------------------------------------------------------------------------------------------------------------------------------------------------------------------------------------------------------------------------------------------------------------------------------------------------------------------------------------------------------------------------------------------+
| Table      | Create Table                                                                                                                                                                                                                                                                                                                                                                                                                                                                                                                                                                                                                                                                                                                                                                                                                                                                                                                                                                                                                                                     |
+------------+-------------------------------------------------------------------------------------------------------------------------------------------------------------------------------------------------------------------------------------------------------------------------------------------------------------------------------------------------------------------------------------------------------------------------------------------------------------------------------------------------------------------------------------------------------------------------------------------------------------------------------------------------------------------------------------------------------------------------------------------------------------------------------------------------------------------------------------------------------------------------------------------------------------------------------------------------------------------------------------------------------------------------------------------------------------------------------------------------------------------------------------------------------------------+
| agent_data | CREATE TABLE `agent_data` (
  `id` int(8) NOT NULL auto_increment,
  `account_id` int(11) NOT NULL default '0',
  `parent_id` int(8) NOT NULL default '0',
  `phone_number` varchar(64) NOT NULL default '',
  `hard_login_time` int(11) default '0',
  `soft_login_time` int(8) default '0',
  `hard_logoff_time` int(8) default '0',
  `soft_logoff_time` int(8) default '0',
  `unanswered_calls_limit` int(8) default '1',
  `unanswered_calls_cnt` int(8) default '0',
  `next_call_can_start` int(8) default '0',
  `last_call_end_time` int(8) default '0',
  `calls_served` int(8) default '0',
  `is_queue_supervisor` int(1) default '0',
  `availability_status` char(3) default 'NA',
  `last_call_assigned_time` int(8) default '0',
  `login_status` int(11) default '0',
  `call_status` char(3) default 'NA',
  `call_record_id` int(11) NOT NULL default '0',
  `last_phone_number` varchar(64) NOT NULL default '',
  PRIMARY KEY  (`id`),
  UNIQUE KEY `id` (`id`),
  KEY `id_2` (`id`,`account_id`,`parent_id`),
  KEY `account_id` (`account_id`),
  KEY `parent_id` (`parent_id`)
) ENGINE=MyISAM AUTO_INCREMENT=126 DEFAULT CHARSET=latin1 |
+------------+-------------------------------------------------------------------------------------------------------------------------------------------------------------------------------------------------------------------------------------------------------------------------------------------------------------------------------------------------------------------------------------------------------------------------------------------------------------------------------------------------------------------------------------------------------------------------------------------------------------------------------------------------------------------------------------------------------------------------------------------------------------------------------------------------------------------------------------------------------------------------------------------------------------------------------------------------------------------------------------------------------------------------------------------------------------------------------------------------------------------------------------------------------------------+
1 row in set (0.00 sec)

last_outgoing	last_incoming	other_side	my_side	voice_mail	low_volume	copped_words	background_noise	static_interference	repeat_sentences	call_completed	resolution_recommendation




CREATE TABLE `bad_call_data` (
  `id` int(11) NOT NULL auto_increment,
  `caller_details` varchar(64) NOT NULL default '',
  `timestamp_of_feedback_call` int(11) default '0',
  `last_outgoing` int(1) default '0',
  `last_incoming` int(1) default '0',
  `other_side` int(1) default '0',
  `my_side` int(1) default '0',
  `voice_mail` varchar(64) default '',
  `low_volume` int(1) default '0',
  `chopped_words` int(1) default '0',
  `background_noise` int(1) default '0',
  `static_interference` int(1) default '0',
  `repeat_sentences` int(1) default '0',
  `call_completed` int(1) default '0',
  `resolution_recommendation` varchar(64) NOT NULL default '',
  PRIMARY KEY  (`id`)
) ENGINE=MyISAM AUTO_INCREMENT=19 DEFAULT CHARSET=latin1;

|
+------------+-------------------------------------------------------------------------------------------------------------------------------------------------------------------------------------------------------------------------------------------------------------------------------------------------------------------------------------------------------------------------------------------------------------------------------------------------------------------------------------------------------------------------------------------------------------------------------------------------------------------------------------------------------------------------------------------------------------------------------------------------------------------------------------------------------------------------------------------------------------------------------------------------------------------------------------------------------------------------------------------------------------------------------------------------------------------------------------------------------------------------------------------------------------------+
1 row in set (0.00 sec)

INSERT INTO `bad_call_data` (`caller_details`, `timestamp_of_feedback_call`, `last_outgoing`, `last_incoming`, `other_side`, `my_side`, `voice_mail`, `low_volume`, `chopped_words`, `background_noise`, `static_interference`, `repeat_sentences`, `call_completed`, `resolution_recommendation`) VALUES ('testing', UNIX_TIMESTAMP(), 1, 1, 1, 1, 0, 0, 0, 0, 0, 0, 1, 'Testing 9');

INSERT INTO `bad_call_data` (`caller_details`, `timestamp_of_feedback_call`, `last_outgoing`, `last_incoming`, `other_side`, `my_side`, `voice_mail`, `low_volume`, `chopped_words`, `background_noise`, `static_interference`, `repeat_sentences`, `call_completed`, `resolution_recommendation`)
VALUES(
'testing', # `caller_details`
UNIX_TIMESTAMP(), # `timestamp_of_feedback_call`
1, # `last_outgoing`
1, # `last_incoming`
1, # `other_side`
1, # `my_side`
0, # `voice_mail`
0, # `low_volume`
0, # `chopped_words`
0, # `background_noise`
0, # `static_interference`
0, # `repeat_sentences`
1, # `call_completed`
'Call Back to caller' # `resolution_recommendation`
);

php reading params:

$from_number = $argv[1];
$call_id = $argv[2];
$call_id = urldecode( $call_id );
$temp_file_name = $argv[3];
$call_completed = $argv[4];
$last_outgoing= $argv[5];
$last_incoming = $argv[6];
$my_side = $argv[7];
$other_side = $argv[8];
$low_volume = $argv[9];
$chopped_words = $argv[10];
$background_noise = $argv[11];
$static_interference = $argv[12];
$repeat_sentences = $argv[13];
$resolution_recommendation = $argv[14];


PHP Command line arguments:
$from_number $call_id $temp_file_name $call_completed $last_outgoing $last_incoming $my_side $other_side $low_volume $chopped_words $background_noise $static_interference $repeat_sentences $resolution_recommendation


XScript call:
/usr/local/registrator/lib/mserver/app/process_bad_audio_complaint.php $FROM_NUMBER $CALL_ID $TEMP_FILE_NAME $STATUS $LAST_OUTGOING $LAST_INCOMING $MY_SIDE $OTHER_SIDE $LOW_VOLUME $CHOPPED_WORDS $BACKGROUND_NOISE $STATIC_INTERFERENCE $REPEAT_SENTENCES $CALL_COMPLETED $RESOLUTION_RECOMMENDATION



CLEAN TEST Entries:
DELETE FROM `bad_call_data` WHERE `id` < 8;



Test plan:
Common to all cases:
Step 1: Dial *09
Case 1: No reaction to prompt
Step 2:
Expected Response: "Goodbye" (CORRECT)

Case 2: Press '2' at prompt
Step 2:
Expected Response: "Goodbye" (CORRECT)

Case 3: Press '3' at prompt
Step 2:
Expected Response: Q.2  (CORRECT)
Case 3.1: Press '3' at prompt
Expected Response: Q.3 Verification line then Q.4 and then Q.4.2
Actual Response: Q.4 and then Q.4.2(WRONG)

CREATE TABLE `bad_call_data` (
    `id` int(11) NOT NULL auto_increment,
    `device` int(11) default NULL,
    `user`  int(11) default NULL,
    `callid` varchar(64) NOT NULL default '',
    `timestamp_of_feedback_call` int(11) default '0',
    `last_outgoing` int(1) default '0',
    `last_incoming` int(1) default '0',
    `other_side` int(1) default '0',
    `my_side` int(1) default '0',
    `voice_mail` varchar(128) default '',
    `low_volume` int(1) default '0',
    `chopped_words` int(1) default '0',
    `background_noise` int(1) default '0',
    `static_interference` int(1) default '0',
    `repeat_sentences` int(1) default '0',
    `call_completed` int(1) default '0',
    `resolution_recommendation` varchar(64) NOT NULL default '',
    PRIMARY KEY  (`id`)
) ENGINE=MyISAM AUTO_INCREMENT=1 DEFAULT CHARSET=latin1

ALTER TABLE `bad_call_data`
ADD `device` int(11) default NULL,
ADD `user` int(11) default NULL;


What do we say in the questions:

additional.wav  'If ypu have additional details and want to leave a voice message please press 1 now. press 0 if you want to be connected to customer service'
automated_system.wav    'Thank you for calling an automated reporting system. If you would like to report an issue about a very recent phone call with us, please press '1' '
choose_one.wav  'Please  choose_one of the following options'
direction.wav   'Press '1' if the problem was with last outgoing call, or press '2' for incoming call. Press 3 if both recent calls had problems'
expirience.wav  'Please provide your experience after the beep. When finished press '#' or simply hang up'
invalid_entry.wav   'Invalid entry'
reason.wav  'If you were told by the other person that they can't hear you well, press '1'. If only you have noticed the problem, press '2', or press '3' if both sides noticed the problem. Press '4' if call was inerrupted unexpectedly'
thanks_bye.wav  'Thank you, your report is noted, you may hangup now'

INSERT INTO  `emailQueue` (`type`, `state`, `parameters`) VALUES('CallTroubleReport', 10, '{\"callTroubleId\": $new_id}')";


SELECT `id`, `phone_account_id`, `caller_account_id`, FROM_UNIXTIME(`timestamp_of_feedback_call`) as log_time, `last_outgoing`, `last_incoming`, `other_side`, `my_side`, `voicemail`, `call_completed`, `resolution_recommendation`  FROM `bad_call_data` ORDER BY `timestamp_of_feedback_call` DESC LIMIT 10;

SELECT `id`, `phone_account_id`, `caller_account_id`, FROM_UNIXTIME(`timestamp_of_feedback_call`) as log_time, `last_outgoing` + 2 * `last_incoming` as direction, `other_side` +2 * `my_side` as `noticed_by`, `voicemail`, `call_completed`, `resolution_recommendation`  FROM `bad_call_data` ORDER BY `timestamp_of_feedback_call` DESC LIMIT 2;
+----+--------+------+---------------------+-----------+------------+----------------------------------------------------------------------------------------------------------------------+----------------+---------------------------+
| id | device | user | log_time            | direction | noticed_by | voice_mail                                                                                                           | call_completed | resolution_recommendation |
+----+--------+------+---------------------+-----------+------------+----------------------------------------------------------------------------------------------------------------------+----------------+---------------------------+
| 64 |  10664 | 1565 | 2020-05-18 11:30:08 |         1 |          1 | /usr/local/registrator/prompts/personal/voicemail/siptalk64.xcastlabs.com/0a/bad_audio_report-1589819401.6681.84.wav |              1 | Call Back to caller       |
| 63 |  10664 | 1565 | 2020-05-18 11:23:11 |         1 |          2 | 0                                                                                                                    |              1 | Call Back to caller       |
+----+--------+------+---------------------+-----------+------------+----------------------------------------------------------------------------------------------------------------------+----------------+---------------------------+

 you last <incoming|outgoing> call, <you| other party | both of you> had to <repeat sentences | experienced < chopped words | low volume | background noise | static interference> >.


Raw hints into how to incorporate the information for human consumption:
BODY = "Caller (id=$user reported at $log time from device id $device that <Which Call> recent call(s) had audio quality issues. <Who noticed the problem> noticed the problem. <Was the call interrupted >.
There is a recording of the situation in file <`voicemail`>"





CREATE TABLE `bad_call_data` (
    `id` int(11) NOT NULL auto_increment,
    `phone_account_id` int(11) default NULL,
    `caller_account_id`  int(11) default NULL,
    `callid` varchar(64) NOT NULL default '',
    `timestamp_of_feedback_call` int(11) default '0',
    `last_outgoing` int(1) default '0',
    `last_incoming` int(1) default '0',
    `other_side` int(1) default '0',
    `my_side` int(1) default '0',
    `voicemail` varchar(128) default '',
    `low_volume` int(1) default '0',
    `chopped_words` int(1) default '0',
    `background_noise` int(1) default '0',
    `static_interference` int(1) default '0',
    `repeat_sentences` int(1) default '0',
    `call_completed` int(1) default '0',
    `resolution_recommendation` varchar(64) NOT NULL default '',
    PRIMARY KEY  (`id`)
) ENGINE=MyISAM AUTO_INCREMENT=1 DEFAULT CHARSET=latin1

MariaDB:
#ALTER TABLE `bad_call_data`
#RENAME COLUMN  `device` TO `phone_account_id`,

Prceedure for ENGINE=MyISAM:

ALTER TABLE `bad_call_data`
CHANGE `user` `caller_account_id` INT(11) NULL DEFAULT NULL,
CHANGE `device` `phone_account_id` INT(11) NULL DEFAULT NULL,
ALTER TABLE `bad_call_data` CHANGE `voice_mail` `voicemail`  varchar(128) default '';



SHOW CREATE TABLE `bad_call_data`;
+---------------+---------------------------------------------------------------------------------------------------------------------------------------------------------------------------------------------------------------------------------------------------------------------------------------------------------------------------------------------------------------------------------------------------------------------------------------------------------------------------------------------------------------------------------------------------------------------------------------------------------------------------------------------------------------------------------------------------------------------------------------------------------------------------------------------------------------------------------------------------------+
| Table         | Create Table                                                                                                                                                                                                                                                                                                                                                                                                                                                                                                                                                                                                                                                                                                                                                                                                                                            |
+---------------+---------------------------------------------------------------------------------------------------------------------------------------------------------------------------------------------------------------------------------------------------------------------------------------------------------------------------------------------------------------------------------------------------------------------------------------------------------------------------------------------------------------------------------------------------------------------------------------------------------------------------------------------------------------------------------------------------------------------------------------------------------------------------------------------------------------------------------------------------------+
| bad_call_data | CREATE TABLE `bad_call_data` (
  `id` int(11) NOT NULL auto_increment,
  `phone_account_id` int(11) default NULL,
  `caller_account_id` int(11) default NULL,
  `caller_details` varchar(64) NOT NULL default '',
  `timestamp_of_feedback_call` int(11) default '0',
  `last_outgoing` int(1) default '0',
  `last_incoming` int(1) default '0',
  `other_side` int(1) default '0',
  `my_side` int(1) default '0',
  `voicemail` varchar(128) default '',
  `low_volume` int(1) default '0',
  `chopped_words` int(1) default '0',
  `background_noise` int(1) default '0',
  `static_interference` int(1) default '0',
  `repeat_sentences` int(1) default '0',
  `call_completed` int(1) default '0',
  `resolution_recommendation` varchar(64) NOT NULL default '',
  PRIMARY KEY  (`id`)
) ENGINE=MyISAM AUTO_INCREMENT=65 DEFAULT CHARSET=latin1 |
+---------------+---------------------------------------------------------------------------------------------------------------------------------------------------------------------------------------------------------------------------------------------------------------------------------------------------------------------------------------------------------------------------------------------------------------------------------------------------------------------------------------------------------------------------------------------------------------------------------------------------------------------------------------------------------------------------------------------------------------------------------------------------------------------------------------------------------------------------------------------------------+

SELECT `id`, `phone_account_id`, `caller_account_id`, FROM_UNIXTIME(`timestamp_of_feedback_call`) as log_time, `last_outgoing` + 2 * `last_incoming` as direction, `other_side` +2 * `my_side` as `noticed_by`, `voicemail`, `call_completed`, `resolution_recommendation`  FROM `bad_call_data` ORDER BY `timestamp_of_feedback_call` DESC LIMIT 2;
+----+------------------+-------------------+---------------------+-----------+------------+-----------+----------------+---------------------------+
| id | phone_account_id | caller_account_id | log_time            | direction | noticed_by | voicemail | call_completed | resolution_recommendation |
+----+------------------+-------------------+---------------------+-----------+------------+-----------+----------------+---------------------------+
| 66 |             7282 |             16064 | 2020-05-19 08:11:48 |         3 |          3 | 0         |              1 | Call Back to caller       |
| 65 |             7282 |             16064 | 2020-05-19 08:09:44 |         3 |          0 | 0         |              0 | Call Back to caller       |
+----+------------------+-------------------+---------------------+-----------+------------+-----------+----------------+---------------------------+
2 rows in set (0.00 sec)


CREATE TABLE `bad_call_data` (
  `id` int(11) NOT NULL auto_increment,
  `phone_account_id` int(11) default NULL,
  `caller_account_id` int(11) default NULL,
  `caller_details` varchar(64) NOT NULL default '',
  `timestamp_of_feedback_call` int(11) default '0',
  `voicemail` varchar(128) default '',
  `resolution_recommendation` varchar(64) NOT NULL default '',
  `survey_answers` text,
  PRIMARY KEY  (`id`)
) ENGINE=MyISAM AUTO_INCREMENT=1 DEFAULT CHARSET=latin1;


ALTER TABLE `bad_call_data`
ADD `survey_answers` text;


survey_answers = '{
  "last_outgoing": 0,
  "last_incoming": 0,
  "other_side": 0,
  "my_side": 0,
  "low_volume": 0,
  "chopped_words": 0,
  "background_noise": 0,
  "static_interference": 0,
  "repeat_sentences": 0,
  "call_completed": 0
}'


ls -l /net/home/ndarmoni/git_rpm_scripts/Registrator/scripts/utils/process_bad_audio_complaint.php ~xcast/bin/process_bad_audio_complaint.php.fix_name

Server: pbxdata-virt-la.siptalk.com:3306
￼Database: sip
￼Table: bad_call_data
